{
  "$schema": "https://json-schema.org/draft/2020-12/schema",
  "title": "SH22-LKS 2OG - Austauschformat eines tatsächlichen Erkennungsversuchs",
  "type": "object",
  "additionalProperties": false,
  "required": [
    "schema_version",
    "floor",
    "run",
    "objects",
    "connections",
    "assessments",
    "open_questions"
  ],
  "properties": {
    "schema_version": {
      "const": "rivoplan.2og.result/1"
    },
    "floor": {
      "const": "2OG"
    },
    "run": {
      "type": "object",
      "additionalProperties": false,
      "required": [
        "status",
        "engine_name",
        "code_commit",
        "executed_at",
        "source_dxf_sha256",
        "source_pdf_sha256",
        "command",
        "notes"
      ],
      "properties": {
        "status": {
          "enum": [
            "nicht_ausgefuehrt",
            "ausgefuehrt",
            "fehlgeschlagen"
          ]
        },
        "engine_name": {
          "type": [
            "string",
            "null"
          ]
        },
        "code_commit": {
          "type": [
            "string",
            "null"
          ]
        },
        "executed_at": {
          "type": [
            "string",
            "null"
          ]
        },
        "source_dxf_sha256": {
          "const": "61ba94fe55ba1e365bdc82cdc85dd230a9c1cc632acb1ef9865ad37f0e9c4df5"
        },
        "source_pdf_sha256": {
          "const": "03409f14145f0fb0046d289319c1bf7edf239db127ece82dfeb2565cbec7d76c"
        },
        "command": {
          "type": [
            "string",
            "null"
          ]
        },
        "notes": {
          "type": "string"
        }
      }
    },
    "objects": {
      "type": "array",
      "items": {
        "type": "object",
        "additionalProperties": false,
        "required": [
          "id",
          "kind",
          "status",
          "coordinate_space",
          "geometry",
          "evidence"
        ],
        "properties": {
          "id": {
            "type": "string",
            "minLength": 1
          },
          "kind": {
            "enum": [
              "wall",
              "column",
              "partition",
              "door",
              "window",
              "glass_barrier",
              "guardrail",
              "parapet",
              "floor_area",
              "stairs",
              "elevator",
              "maintenance_area",
              "void_or_unresolved",
              "furniture",
              "open_passage"
            ]
          },
          "status": {
            "enum": [
              "candidate",
              "confirmed",
              "rejected"
            ]
          },
          "coordinate_space": {
            "enum": [
              "DXF_MODEL_MM",
              "PDF_SOURCE_PT"
            ]
          },
          "geometry": {
            "$ref": "#/$defs/geometry"
          },
          "evidence": {
            "type": "array",
            "minItems": 1,
            "items": {
              "$ref": "#/$defs/evidence"
            }
          }
        }
      }
    },
    "connections": {
      "type": "array",
      "items": {
        "type": "object",
        "additionalProperties": false,
        "required": [
          "id",
          "from_object",
          "to_object",
          "via_object",
          "kind",
          "status",
          "walkable",
          "target_floor",
          "height_delta_m",
          "evidence"
        ],
        "properties": {
          "id": {
            "type": "string",
            "minLength": 1
          },
          "from_object": {
            "type": "string",
            "minLength": 1
          },
          "to_object": {
            "type": "string",
            "minLength": 1
          },
          "via_object": {
            "type": [
              "string",
              "null"
            ]
          },
          "kind": {
            "enum": [
              "door",
              "open_passage",
              "stairs",
              "elevator"
            ]
          },
          "status": {
            "enum": [
              "candidate",
              "confirmed",
              "rejected"
            ]
          },
          "walkable": {
            "type": [
              "boolean",
              "null"
            ]
          },
          "target_floor": {
            "type": [
              "string",
              "null"
            ]
          },
          "height_delta_m": {
            "type": [
              "number",
              "null"
            ]
          },
          "evidence": {
            "type": "array",
            "minItems": 1,
            "items": {
              "$ref": "#/$defs/evidence"
            }
          }
        }
      }
    },
    "assessments": {
      "type": "array",
      "items": {
        "type": "object",
        "additionalProperties": false,
        "required": [
          "example_id",
          "outcome",
          "reason"
        ],
        "properties": {
          "example_id": {
            "enum": [
              "W01",
              "W02",
              "W03",
              "W04",
              "W05",
              "W06",
              "W07",
              "W08",
              "D01",
              "D02",
              "D03",
              "D04",
              "F01",
              "F02",
              "F03",
              "G01",
              "G02",
              "G03",
              "G04",
              "G05",
              "S01",
              "S02",
              "S03",
              "S04",
              "S05"
            ]
          },
          "outcome": {
            "enum": [
              "erfuellt",
              "verfehlt",
              "unklar",
              "nicht_geprueft"
            ]
          },
          "reason": {
            "type": "string"
          }
        }
      }
    },
    "open_questions": {
      "type": "array",
      "items": {
        "type": "string"
      }
    }
  },
  "$defs": {
    "point": {
      "type": "array",
      "minItems": 2,
      "maxItems": 2,
      "items": {
        "type": "number"
      }
    },
    "line": {
      "type": "array",
      "minItems": 2,
      "items": {
        "$ref": "#/$defs/point"
      }
    },
    "ring": {
      "type": "array",
      "minItems": 4,
      "items": {
        "$ref": "#/$defs/point"
      }
    },
    "polygon": {
      "type": "array",
      "minItems": 1,
      "items": {
        "$ref": "#/$defs/ring"
      }
    },
    "geometry": {
      "oneOf": [
        {
          "type": "object",
          "additionalProperties": false,
          "required": [
            "type",
            "coordinates"
          ],
          "properties": {
            "type": {
              "const": "Point"
            },
            "coordinates": {
              "$ref": "#/$defs/point"
            }
          }
        },
        {
          "type": "object",
          "additionalProperties": false,
          "required": [
            "type",
            "coordinates"
          ],
          "properties": {
            "type": {
              "const": "LineString"
            },
            "coordinates": {
              "$ref": "#/$defs/line"
            }
          }
        },
        {
          "type": "object",
          "additionalProperties": false,
          "required": [
            "type",
            "coordinates"
          ],
          "properties": {
            "type": {
              "const": "Polygon"
            },
            "coordinates": {
              "$ref": "#/$defs/polygon"
            }
          }
        },
        {
          "type": "object",
          "additionalProperties": false,
          "required": [
            "type",
            "coordinates"
          ],
          "properties": {
            "type": {
              "const": "MultiPolygon"
            },
            "coordinates": {
              "type": "array",
              "minItems": 1,
              "items": {
                "$ref": "#/$defs/polygon"
              }
            }
          }
        }
      ]
    },
    "evidence": {
      "type": "object",
      "additionalProperties": false,
      "required": [
        "source_file",
        "page",
        "handles",
        "original_texts",
        "example_refs",
        "reason"
      ],
      "properties": {
        "source_file": {
          "enum": [
            "quellen/20220225-SH22-LKS-GE-AP-02-01-A-2OG.dxf",
            "quellen/Schule_SH22_2_OG.pdf"
          ]
        },
        "page": {
          "type": [
            "integer",
            "null"
          ],
          "minimum": 1
        },
        "handles": {
          "type": "array",
          "items": {
            "type": "string"
          }
        },
        "original_texts": {
          "type": "array",
          "items": {
            "type": "string"
          }
        },
        "example_refs": {
          "type": "array",
          "items": {
            "enum": [
              "W01",
              "W02",
              "W03",
              "W04",
              "W05",
              "W06",
              "W07",
              "W08",
              "D01",
              "D02",
              "D03",
              "D04",
              "F01",
              "F02",
              "F03",
              "G01",
              "G02",
              "G03",
              "G04",
              "G05",
              "S01",
              "S02",
              "S03",
              "S04",
              "S05"
            ]
          }
        },
        "reason": {
          "type": "string",
          "minLength": 1
        }
      }
    }
  }
}
